ID,title,description,level,createdAt,modifiedAt
1,Software Engineer,Design and develop software applications,Mid,2024-01-01T00:00:00.000Z,2024-01-01T00:00:00.000Z
2,Senior Software Engineer,Lead software development projects,Senior,2024-01-01T00:00:00.000Z,2024-01-01T00:00:00.000Z
3,Engineering Manager,Manage engineering teams and projects,Manager,2024-01-01T00:00:00.000Z,2024-01-01T00:00:00.000Z
4,HR Specialist,Handle employee relations and recruitment,Mid,2024-01-01T00:00:00.000Z,2024-01-01T00:00:00.000Z
5,HR Manager,Oversee HR operations and strategy,Manager,2024-01-01T00:00:00.000Z,2024-01-01T00:00:00.000Z
6,Financial Analyst,Analyze financial data and prepare reports,Mid,2024-01-01T00:00:00.000Z,2024-01-01T00:00:00.000Z
7,Marketing Coordinator,Coordinate marketing campaigns and events,Junior,2024-01-01T00:00:00.000Z,2024-01-01T00:00:00.000Z
8,Sales Representative,Sell products and maintain client relationships,Mid,2024-01-01T00:00:00.000Z,2024-01-01T00:00:00.000Z
